{
 "date": "2026-09-15",
 "baseline_date": "2026-09-14",
 "items": [
  {
   "item_id": "item-76f65953",
   "kind": "cve",
   "areas": [
    "endpoints"
   ],
   "tier": 1,
   "priority": "critical",
   "status": "continued",
   "continued_days": 19,
   "score": 90,
   "score_parts": {},
   "tlp": "amber_strict",
   "first_seen": "2026-08-28",
   "confidence": "",
   "identifiers": [
    "CVE-2026-92062",
    "CVE-2026-90011"
   ],
   "title": "Kestrel Device Manager: stored cross-site scripting",
   "description": "Kestrel Device Manager is affected by stored cross-site scripting. Status: exploited in the wild. Fictional advisory text generated for a shareable sample; the shape mirrors a real brief item without any real product, vendor or institution.",
   "source": {
    "name": "Vendor advisory",
    "url": "",
    "retrieved": "2026-09-15"
   },
   "su_impact": "",
   "recommended_actions": [],
   "escalation": {
    "required": false,
    "to": "",
    "note": ""
   },
   "cve_published": null,
   "attack": [],
   "indicators": [],
   "delta": "Score raised from 87 to 90 after new reporting.",
   "body": "Exploitation status: exploited in the wild. Score raised from 87 to 90 after new reporting. This analysis text is synthetic."
  },
  {
   "item_id": "item-edb6d3eb",
   "kind": "cve",
   "areas": [
    "webapps",
    "research"
   ],
   "tier": 1,
   "priority": "critical",
   "status": "continued",
   "continued_days": 3,
   "score": 88,
   "score_parts": {},
   "tlp": "amber_strict",
   "first_seen": "2026-09-13",
   "confidence": "",
   "identifiers": [
    "CVE-2026-96986"
   ],
   "title": "Lantern MFA Connector: deserialization of untrusted data",
   "description": "Lantern MFA Connector is affected by deserialization of untrusted data. Status: exploitation reported by one vendor. Fictional advisory text generated for a shareable sample; the shape mirrors a real brief item without any real product, vendor or institution.",
   "source": {
    "name": "Vendor advisory",
    "url": "",
    "retrieved": "2026-09-15"
   },
   "su_impact": "",
   "recommended_actions": [],
   "escalation": {
    "required": false,
    "to": "",
    "note": ""
   },
   "cve_published": null,
   "attack": [],
   "indicators": [],
   "delta": "Score raised from 86 to 88 after new reporting.",
   "body": "Exploitation status: exploitation reported by one vendor. Score raised from 86 to 88 after new reporting. This analysis text is synthetic."
  },
  {
   "item_id": "item-65c96399",
   "kind": "cve",
   "areas": [
    "perimeter"
   ],
   "tier": 1,
   "priority": "critical",
   "status": "continued",
   "continued_days": 36,
   "score": 85,
   "score_parts": {},
   "tlp": "amber_strict",
   "first_seen": "2026-08-11",
   "confidence": "",
   "identifiers": [
    "CVE-2026-95503",
    "CVE-2026-97489",
    "CVE-2026-93473"
   ],
   "title": "Saltmarsh Access Gateway: memory disclosure leaking session tokens",
   "description": "Saltmarsh Access Gateway is affected by memory disclosure leaking session tokens. Status: added to a government known-exploited list. Fictional advisory text generated for a shareable sample; the shape mirrors a real brief item without any real product, vendor or institution.",
   "source": {
    "name": "Vendor advisory",
    "url": "",
    "retrieved": "2026-09-15"
   },
   "su_impact": "",
   "recommended_actions": [],
   "escalation": {
    "required": false,
    "to": "",
    "note": ""
   },
   "cve_published": null,
   "attack": [],
   "indicators": [],
   "delta": "Score lowered from 88 to 85; exposure unchanged.",
   "body": "Exploitation status: added to a government known-exploited list. Score lowered from 88 to 85; exposure unchanged. This analysis text is synthetic."
  },
  {
   "item_id": "item-207922be",
   "kind": "cve",
   "areas": [
    "perimeter",
    "email"
   ],
   "tier": 1,
   "priority": "critical",
   "status": "new",
   "continued_days": 0,
   "score": 80,
   "score_parts": {},
   "tlp": "amber_strict",
   "first_seen": "2026-09-15",
   "confidence": "",
   "identifiers": [
    "CVE-2026-97392"
   ],
   "title": "Kestrel Access Gateway: command injection in a management endpoint",
   "description": "Kestrel Access Gateway is affected by command injection in a management endpoint. Status: added to a government known-exploited list. Fictional advisory text generated for a shareable sample; the shape mirrors a real brief item without any real product, vendor or institution.",
   "source": {
    "name": "Vendor advisory",
    "url": "",
    "retrieved": "2026-09-15"
   },
   "su_impact": "",
   "recommended_actions": [],
   "escalation": {
    "required": false,
    "to": "",
    "note": ""
   },
   "cve_published": null,
   "attack": [],
   "indicators": [],
   "delta": "New this cycle.",
   "body": "Exploitation status: added to a government known-exploited list. New this cycle. This analysis text is synthetic."
  },
  {
   "item_id": "item-b65449d0",
   "kind": "cve",
   "areas": [
    "other"
   ],
   "tier": 1,
   "priority": "high",
   "status": "continued",
   "continued_days": 7,
   "score": 75,
   "score_parts": {},
   "tlp": "amber_strict",
   "first_seen": "2026-09-09",
   "confidence": "",
   "identifiers": [
    "CVE-2026-94250",
    "CVE-2026-92983"
   ],
   "title": "Halyard Device Manager advisory: privilege escalation via a race condition",
   "description": "Halyard Device Manager advisory is affected by privilege escalation via a race condition. Status: added to a government known-exploited list. Fictional advisory text generated for a shareable sample; the shape mirrors a real brief item without any real product, vendor or institution.",
   "source": {
    "name": "Vendor advisory",
    "url": "",
    "retrieved": "2026-09-15"
   },
   "su_impact": "",
   "recommended_actions": [],
   "escalation": {
    "required": false,
    "to": "",
    "note": ""
   },
   "cve_published": null,
   "attack": [],
   "indicators": [],
   "delta": "Score raised from 65 to 75 after new reporting.",
   "body": "Exploitation status: added to a government known-exploited list. Score raised from 65 to 75 after new reporting. This analysis text is synthetic."
  },
  {
   "item_id": "item-154802b5",
   "kind": "campaign",
   "areas": [
    "identity",
    "endpoints",
    "perimeter"
   ],
   "tier": 2,
   "priority": "high",
   "status": "new",
   "continued_days": 0,
   "score": 70,
   "score_parts": {},
   "tlp": "amber_strict",
   "first_seen": "2026-09-15",
   "confidence": "",
   "identifiers": [],
   "title": "Granary Identity Gateway advisory: deserialization of untrusted data",
   "description": "Granary Identity Gateway advisory is affected by deserialization of untrusted data. Status: exploitation reported by one vendor. Fictional advisory text generated for a shareable sample; the shape mirrors a real brief item without any real product, vendor or institution.",
   "source": {
    "name": "Vendor advisory",
    "url": "",
    "retrieved": "2026-09-15"
   },
   "su_impact": "",
   "recommended_actions": [],
   "escalation": {
    "required": false,
    "to": "",
    "note": ""
   },
   "cve_published": null,
   "attack": [],
   "indicators": [],
   "delta": "New this cycle.",
   "body": "Exploitation status: exploitation reported by one vendor. New this cycle. This analysis text is synthetic."
  },
  {
   "item_id": "item-8b43ffd4",
   "kind": "cve",
   "areas": [
    "endpoints",
    "perimeter"
   ],
   "tier": 2,
   "priority": "high",
   "status": "new",
   "continued_days": 0,
   "score": 66,
   "score_parts": {},
   "tlp": "amber_strict",
   "first_seen": "2026-09-15",
   "confidence": "",
   "identifiers": [
    "CVE-2026-99807",
    "CVE-2026-91134"
   ],
   "title": "Halyard Workstation Image: improper certificate validation",
   "description": "Halyard Workstation Image is affected by improper certificate validation. Status: exploited in the wild. Fictional advisory text generated for a shareable sample; the shape mirrors a real brief item without any real product, vendor or institution.",
   "source": {
    "name": "Vendor advisory",
    "url": "",
    "retrieved": "2026-09-15"
   },
   "su_impact": "",
   "recommended_actions": [],
   "escalation": {
    "required": false,
    "to": "",
    "note": ""
   },
   "cve_published": null,
   "attack": [],
   "indicators": [],
   "delta": "New this cycle.",
   "body": "Exploitation status: exploited in the wild. New this cycle. This analysis text is synthetic."
  },
  {
   "item_id": "item-19c4a6f1",
   "kind": "cve",
   "areas": [
    "identity",
    "perimeter",
    "cloud"
   ],
   "tier": 2,
   "priority": "high",
   "status": "new",
   "continued_days": 0,
   "score": 65,
   "score_parts": {},
   "tlp": "amber_strict",
   "first_seen": "2026-09-15",
   "confidence": "",
   "identifiers": [
    "CVE-2026-97873"
   ],
   "title": "Dovetail Directory Service: privilege escalation via a race condition",
   "description": "Dovetail Directory Service is affected by privilege escalation via a race condition. Status: no exploitation observed. Fictional advisory text generated for a shareable sample; the shape mirrors a real brief item without any real product, vendor or institution.",
   "source": {
    "name": "Vendor advisory",
    "url": "",
    "retrieved": "2026-09-15"
   },
   "su_impact": "",
   "recommended_actions": [],
   "escalation": {
    "required": false,
    "to": "",
    "note": ""
   },
   "cve_published": null,
   "attack": [],
   "indicators": [],
   "delta": "New this cycle.",
   "body": "Exploitation status: no exploitation observed. New this cycle. This analysis text is synthetic."
  },
  {
   "item_id": "item-7f442c58",
   "kind": "cve",
   "areas": [
    "perimeter"
   ],
   "tier": 2,
   "priority": "high",
   "status": "new",
   "continued_days": 0,
   "score": 60,
   "score_parts": {},
   "tlp": "amber_strict",
   "first_seen": "2026-09-15",
   "confidence": "",
   "identifiers": [